C1: Prior
A2: MODEL | B2: p=.4 (Becker is better) | C2: .2
B3: p=.5 (same ability) | C3: .3
B4: p=.6 (Agassi is better) | C4: .5

A1: PROPORTION | B1: PRIOR | C1: LIKELIHOOD
A2: p1 | B2: P(p1)
A3: p2 | B3: P(p2)
A5: pk | B5: P(pk)

A1: p | B1: PRIOR | C1: LIKELIHOOD | D1: PRODUCT | E1: POSTERIOR
A2: .4 | B2: .2 | C2: .4 | D2: .2 x .4 =.08 | E2: .08/.53 = .15
A3: .5 | B3: .3 | C3: .5 | D3: .3 x .5 =.15 | E3: .15/.53 = .28
A4: .6 | B4: .5 | C4: .6 | D4: .5 x .6 =.30 | E4: .30/.53 = .57
A5: SUM | D5: .53

C1: DATA
C2: Agassi wins | D2: Becker wins | E2: TOTAL
A3: MODEL | B3: p=.4 (Becker is better) | E3: 60
B4: p=.5 (same ability) | E4: 90
B5: p=.6 (Agassi is better) | E5: 150
B6: TOTAL | E6: 300

C1: DATA
C2: Agassi wins | D2: Becker wins | E2: TOTAL
A3: MODEL | B3: p=.4 (Becker is better) | C3: 24 | D3: 36 | E3: 60
B4: p=.5 (same ability) | C4: 45 | D4: 45 | E4: 90
B5: p=.6 (Agassi is better) | C5: 90 | D5: 60 | E5: 150
B6: TOTAL | E6: 300

C1: DATA
C2: Agassi wins | D2: PROPORTION
A3: MODEL | B3: p=.4 (Becker is better) | C3: 24 | D3: 24/159 = .15
B4: p=.5 (same ability) | C4: 45 | D4: 45/159 = .28
B5: p=.6 (Agassi is better) | C5: 90 | D5: 90/159 = .57
B6: TOTAL | C6: 159 | D6: 1

A1: p | B1: prob | C1: cum prob
A2: 00.7 | B2: 0.29321999999999998 | C2: =B2 -> 0.29321999999999998
A3: 00.6 | B3: 0.23625599999999999 | C3: =C2+B3 -> 0.52947599999999995
A4: 00.8 | B4: 0.22123999999999999 | C4: =C3+B4 -> 0.75071599999999994
A5: 0.5 | B5: 0.128779 | C5: =C4+B5 -> 0.87949499999999992
A6: 00.9 | B6: 6.3073000000000004E-2 | C6: =C5+B6 -> 0.94256799999999996
A7: 00.4 | B7: 4.6668000000000001E-2 | C7: =C6+B7 -> 0.989236
A8: 00.3 | B8: 9.8919999999999998E-3 | C8: =C7+B8 -> 0.99912800000000002
A9: 00.2 | B9: 8.6399999999999997E-4 | C9: =C8+B9 -> 0.99999199999999999
A10: 00.1 | B10: 1.0000000000000001E-5 | C10: =C9+B10 -> 1.0000020000000001
A11: 0 | B11: 0.0000 | C11: =C10+B11 -> 1.0000020000000001
A12: 1 | B12: 0.0000 | C12: =C11+B12 -> 1.0000020000000001